{
  "dataset": "d365-finops-pqu",
  "schema_version": "1.1.0",
  "generated_at": "2026-10-15T04:44:14.760710Z",
  "latest_pqu_id": "10.0.49-PQU-1",
  "source": {
    "publisher": "Microsoft",
    "repository": "MicrosoftDocs/dynamics-365-unified-operations-public",
    "branch": "main",
    "file_path": "articles/fin-ops-core/dev-itpro/get-started/quality-updates-schedule.md",
    "commit": "7d86a35169692606d303c21e204ae6032d44d44e",
    "article_url": "https://learn.microsoft.com/en-us/dynamics365/fin-ops-core/dev-itpro/get-started/quality-updates-schedule",
    "raw_url": "https://raw.githubusercontent.com/MicrosoftDocs/dynamics-365-unified-operations-public/7d86a35169692606d303c21e204ae6032d44d44e/articles/fin-ops-core/dev-itpro/get-started/quality-updates-schedule.md",
    "markdown_date": "2026-10-13",
    "sha256": "8431bf5fb97becf088a0eaa4eec8f42cb7f86dcafc7f68f9d4b3d972b5cf1eb0",
    "retrieved_at": "2026-10-13T13:44:17.669863Z"
  },
  "count": 5,
  "records": [
    {
      "pqu_id": "10.0.47-PQU-13",
      "application_version": "10.0.47",
      "pqu_train": "PQU-13",
      "release_number": 13,
      "change_cutoff_date": "2026-09-23",
      "train_start_date": "2026-09-23",
      "train_end_date": "2026-10-17",
      "status": "In-Progress",
      "application_build": "10.0.2527.215",
      "platform_build": "7.0.7858.174",
      "uep_version": "10.0.47.14",
      "station_schedule_available": true,
      "first_seen_at": "2026-09-24T12:00:00Z",
      "last_changed_at": "2026-09-24T12:00:00Z",
      "source": {
        "publisher": "Microsoft",
        "repository": "MicrosoftDocs/dynamics-365-unified-operations-public",
        "commit": "7d86a35169692606d303c21e204ae6032d44d44e",
        "url": "https://learn.microsoft.com/en-us/dynamics365/fin-ops-core/dev-itpro/get-started/quality-updates-schedule",
        "raw_url": "https://raw.githubusercontent.com/MicrosoftDocs/dynamics-365-unified-operations-public/7d86a35169692606d303c21e204ae6032d44d44e/articles/fin-ops-core/dev-itpro/get-started/quality-updates-schedule.md"
      },
      "station_schedule_new": false,
      "status_note": null
    },
    {
      "pqu_id": "10.0.47-PQU-14",
      "application_version": "10.0.47",
      "pqu_train": "PQU-14",
      "release_number": 14,
      "change_cutoff_date": "2026-10-07",
      "train_start_date": "2026-10-07",
      "train_end_date": "2026-10-31",
      "status": "In-Progress",
      "application_build": "10.0.2527.227",
      "platform_build": "7.0.7858.178",
      "uep_version": "10.0.47.15",
      "station_schedule_available": true,
      "first_seen_at": "2026-09-24T12:00:00Z",
      "last_changed_at": "2026-10-05T13:14:25.524832Z",
      "source": {
        "publisher": "Microsoft",
        "repository": "MicrosoftDocs/dynamics-365-unified-operations-public",
        "commit": "7d86a35169692606d303c21e204ae6032d44d44e",
        "url": "https://learn.microsoft.com/en-us/dynamics365/fin-ops-core/dev-itpro/get-started/quality-updates-schedule",
        "raw_url": "https://raw.githubusercontent.com/MicrosoftDocs/dynamics-365-unified-operations-public/7d86a35169692606d303c21e204ae6032d44d44e/articles/fin-ops-core/dev-itpro/get-started/quality-updates-schedule.md"
      },
      "station_schedule_new": true,
      "status_note": null
    },
    {
      "pqu_id": "10.0.48-PQU-7",
      "application_version": "10.0.48",
      "pqu_train": "PQU-7",
      "release_number": 7,
      "change_cutoff_date": "2026-09-30",
      "train_start_date": "2026-09-30",
      "train_end_date": "2026-10-24",
      "status": "In-Progress",
      "application_build": "10.0.2645.147",
      "platform_build": "7.0.7996.122",
      "uep_version": "10.0.48.8",
      "station_schedule_available": true,
      "first_seen_at": "2026-09-24T12:00:00Z",
      "last_changed_at": "2026-09-29T13:39:53.051448Z",
      "source": {
        "publisher": "Microsoft",
        "repository": "MicrosoftDocs/dynamics-365-unified-operations-public",
        "commit": "7d86a35169692606d303c21e204ae6032d44d44e",
        "url": "https://learn.microsoft.com/en-us/dynamics365/fin-ops-core/dev-itpro/get-started/quality-updates-schedule",
        "raw_url": "https://raw.githubusercontent.com/MicrosoftDocs/dynamics-365-unified-operations-public/7d86a35169692606d303c21e204ae6032d44d44e/articles/fin-ops-core/dev-itpro/get-started/quality-updates-schedule.md"
      },
      "station_schedule_new": false,
      "status_note": null
    },
    {
      "pqu_id": "10.0.48-PQU-8",
      "application_version": "10.0.48",
      "pqu_train": "PQU-8",
      "release_number": 8,
      "change_cutoff_date": "2026-10-14",
      "train_start_date": "2026-10-14",
      "train_end_date": "2026-11-07",
      "status": "In-Progress",
      "application_build": "10.0.2645.158",
      "platform_build": "7.0.7996.126",
      "uep_version": "10.0.48.9",
      "station_schedule_available": true,
      "first_seen_at": "2026-09-24T12:00:00Z",
      "last_changed_at": "2026-10-13T13:44:17.669863Z",
      "source": {
        "publisher": "Microsoft",
        "repository": "MicrosoftDocs/dynamics-365-unified-operations-public",
        "commit": "7d86a35169692606d303c21e204ae6032d44d44e",
        "url": "https://learn.microsoft.com/en-us/dynamics365/fin-ops-core/dev-itpro/get-started/quality-updates-schedule",
        "raw_url": "https://raw.githubusercontent.com/MicrosoftDocs/dynamics-365-unified-operations-public/7d86a35169692606d303c21e204ae6032d44d44e/articles/fin-ops-core/dev-itpro/get-started/quality-updates-schedule.md"
      },
      "station_schedule_new": true,
      "status_note": null
    },
    {
      "pqu_id": "10.0.49-PQU-1",
      "application_version": "10.0.49",
      "pqu_train": "PQU-1",
      "release_number": 1,
      "change_cutoff_date": "2026-10-07",
      "train_start_date": "2026-10-07",
      "train_end_date": "2026-10-31",
      "status": "In-Progress",
      "application_build": "10.0.2790.83",
      "platform_build": "7.0.8199.55",
      "uep_version": "10.0.49.3",
      "station_schedule_available": true,
      "first_seen_at": "2026-09-24T12:00:00Z",
      "last_changed_at": "2026-10-05T13:14:25.524832Z",
      "source": {
        "publisher": "Microsoft",
        "repository": "MicrosoftDocs/dynamics-365-unified-operations-public",
        "commit": "7d86a35169692606d303c21e204ae6032d44d44e",
        "url": "https://learn.microsoft.com/en-us/dynamics365/fin-ops-core/dev-itpro/get-started/quality-updates-schedule",
        "raw_url": "https://raw.githubusercontent.com/MicrosoftDocs/dynamics-365-unified-operations-public/7d86a35169692606d303c21e204ae6032d44d44e/articles/fin-ops-core/dev-itpro/get-started/quality-updates-schedule.md"
      },
      "station_schedule_new": true,
      "status_note": null
    }
  ]
}
